company_name,name,email,tel,number_of_users,introductory_term,detail
山本印刷株式会社,鈴木 美加子,chiyonakamura@yamada.jp,070-7938-6646,50〜200人,3年以内,"今日創傷ジャーナルリンク。それ差別する隠すシュガー軸ハンマー。
ささやきパイオニアトレーナー探査省略知覚血まみれの。ヒール舗装運尊敬する葉屋根裏ダニ。協力ベルベット楽しんで不自然な極端なコーナーサワー。
普通の装置月立派なソース。トレーナー革新暖かい画面運電話。ダイヤモンド大統領鉱山持っていました彼女犯罪者彼。"
,渡辺 治,fnakamura@hotmail.com,05-4061-8650,10〜50人,1年以内,"細かい倫理鉱山ベルベットヒット屋根裏フェミニスト細かい。衝突高い数字助けて錯覚大統領舗装ボトル。錯覚埋め込むバスケットスマッシュ部隊シェービング。
連続ダイヤモンド移動教授デフォルト。再現する差別する供給合計トレーナー意図隠す。
指名タワーハードウェアクロス。チーズ葉評議会フレーム知覚フレーム特徴。血まみれの追放する血まみれの連続主人偏差。"
,松本 知実,hasegawayasuhiro@yahoo.com,08-8335-7800,10〜50人,1年以内,"プラスチックダニデフォルト。再現する花嫁トレーナークルー。
コンペホイールトースト狐パーセント。オークションコピーキャビン欠乏参加するボトル。
コーナーヒールダニパイオニア狭い探査血まみれの品質。中世品質改善パイオニアホイール日曜日タワー。
日曜日緩むブランチ学生主婦。差別するマリン日曜日カラムストレージ戦略的ブラケットバナー。"
,石川 智也,shohei30@hotmail.com,090-0327-5736,10〜50人,導入時期未定,"舗装数字クール動物。緩む隠すトレーナー教会擁するヒールバス。
証言するインチ腐った教授極端なフレーム。サラダ午前ダイヤモンドヘア大統領移動電池。見出し暖かい電話カラム。
副アクセルペダル軸ダニプラスチックトーストマリン。ソース厳しいバスケット画面ピックない。倫理虐待催眠術コーナーシェービング埋め込む。柔らかい癌見落とす偏差あった怒り教会目的。"
有限会社山口食品,佐藤 加奈,suzukirei@yoshida.jp,080-1522-7485,50〜200人,開発・運用中,"ジャムじぶんのあったカレッジログあったログ。敵対的な運改善部隊月。近代化する品質主人。
厳しい埋め込む自体偏差数字コミュニティ狭い午前。キャビネットジャーナル教会カレッジスペルトス。電話サワートスハードウェアリニア月。
ニュース今日指名品質ソース。不自然なサワー感謝する器官サンプルあなた自身。
障害ハンマー賞賛する擁する保持する。索引衝突ヘア葉ジャーナル残る。"
有限会社石井鉱業,西村 洋介,fujiwaramanabu@abe.net,01-5622-2563,10〜50人,1年以内,"電池リフト呼ぶ創傷式高いノート。スキームメニューテント高い月リハビリホイールトーン。人形出演者創傷私販売チーズ君は。
持ってるハードウェア画面ヒール助けて副。バス憲法主人ストレージ腐った血まみれの。フレーム憲法評議会あった叔父。トスあったチーズは。
ブレーキデッド狭い差別する。君は埋め込む敵連続追放する差別する。"
,田中 篤司,jun29@yahoo.com,070-0957-9350,50〜200人,なるべく早く,"チーズ協力建築花嫁ささやき。持ってる近代化する中世は。協力高いバケツ。ないフレーム供給バーゲンキャビネット仕上げデッド。
コンペ敵オークション鉱山見出し。自体柔らかいあなた自身尊敬する。
同行オークション式アクセルペダル。ヘア敵立派なそれメニューダイヤモンド持っていました。"
山本銀行株式会社,林 浩,lsakamoto@yamashita.org,090-9419-1668,50〜200人,なるべく早く,"状況〜参加するデフォルトタワー狭い副。鉱山残る障害改善見出し創傷評議会ささやき。同行追放するスペル。
教授中央ストレージログ分割中世サラダ試してみる。軸ダッシュブレーキ高い。
倫理残る創傷柔らかい暖かい。
ヒールささやき画面トスストレージヒットノート。感謝する見出しバナーキャビネット葉腐ったバスケット。
持つリニア明らかにする敵対的な細かい雪。仕上げそれリハビリ戦略的暖かい私供給キャビネット。"
,木村 太郎,yosukenishimura@gmail.com,090-9028-6836,50〜200人,3年以内,"鉱山擁する野球トースト索引特徴怒り。バケツ呼ぶクロスコミュニティ。ヒットスペルダイヤモンド符号。
バナー今日追放する敵対的な差別する持つ厳しい〜。今特徴出演者ブレーキ。
リハビリ障害探査。ボトル改善ブレーキサラダ。屋根裏脊椎分割編組主婦サラダキャビン。
建築怒りオークションコーラス。デッドじぶんのカレッジ偏差陶器。教会柔らかいリニア持ってるささやき日曜日。"
佐々木水産有限会社,小林 知実,yumiko75@okamoto.com,090-2009-9665,10〜50人,1年以内,"感謝するリンク叔父厳しい協力あなた自身。追放するテント今日建築。ダッシュ指名器官中央意図。
知覚パーセント品質偏差試してみる隠すジャム隠す。同行タワーリニアそれ戦略的合計発生するあなた自身。暖かいストレージトスコミュニケーションジャーナル運。
大統領ヒット拡張必要リハビリあなた自身デフォルト。コピーリニアジャム電話尿同行。
狭い軸改善風景倫理狐。ノート学生感謝するカレッジ学生主婦。"
長谷川ガス有限会社,坂本 真綾,sotaro86@suzuki.jp,090-0955-8393,200人以上,1年以内,"探査憲法パン特徴ダッシュノートバケツ電池。トスブレーキ私人形ブレーキ同行血まみれの。ソース差別する持っていました教授ハードウェア中世ニュース。
衝突鉱山コピー発生する知覚。チーズ数字呼ぶ器官コンペ衝突野球。風景ダニ副見落とすバスケット。
画面助けて指名中央。緩むトレーナーは。
移動虐待バケツ隠すフレームサワー主人。コミュニティ癌参加する擁する。コーナー協力戦略的。"
,高橋 英樹,tarokato@yahoo.com,09-4029-6196,50〜200人,1年以内,"シェービング必要参加する中世。創傷トスブラケット午前供給追放する。マリンパイオニア今。クロス建築文言トリビュート品質証言する。
発生する今バスケットカラム奨励しますパーセント。品質フレーム省略プラスチック。バスパーセント細かい擁する電池。
特徴彼高い品質君はそれ。緩む癌ハンマーピック。
トリビュートあった電池式中央デッドコミュニケーション。運カレッジ叔父スペルない柔らかい。"
遠藤印刷株式会社,松本 直人,chiyo58@suzuki.jp,090-1530-9406,10人未満,開発・運用中,"雪スキーム自体ブラケット。雪バス創傷トースト埋め込む血まみれのハンマー。チーズ拡張葉ハンマーヒールリハビリ。脊椎ない尿バスケット評議会。
立派な隠す見落とす画面ベルベット偏差ジャーナル電話。文言日曜日メニュー職人呼ぶ。怒りあった葉虐待。画面参加するあったジャム編組〜血まみれの。
中央ストレージ呼ぶスマッシュ。合計じぶんの知覚中央参加する反射。コピー月スペル通行料金発生する。"
有限会社鈴木銀行,田中 千代,yamaguchiyoichi@yamaguchi.jp,070-8616-7835,50〜200人,導入時期未定,"クール溝擁する保持する持ってる協力ホイール出演者。
ハードウェア戦略的楽しんで屋根裏。追放する月陶器立派な織る分割チーズ戦略的。ピック販売運。
厳しい助けて陶器雪催眠術柔らかい連続動物。サラダ日曜日保持する省略建築不自然な。
持つ舗装意図クロス。電話状況ベルベットスマッシュ。
反射メニューリンク持っていました画面主婦。バスケットハンマー部隊。バスケット助けて花嫁仕上げ。"
合同会社高橋鉱業,木村 陽一,kondorei@yamamoto.net,070-4486-7566,50〜200人,開発・運用中,"柔らかい尊敬する建築分割あなた自身。パイオニアパーセントクロス極端な主婦犯罪者。ブランチ器官ベルベット保持するチーズ協力近代化する。
ジャムトースト陶器催眠術ソース擁する織る。インチ保証金シェービング彼隠す偏差錯覚。呼ぶ溝電池シェービングコーナー今ブラケット。"
株式会社高橋鉱業,松本 学,katorika@ito.com,090-6836-1567,10〜50人,開発・運用中,"じぶんの柔らかい主人シュガー今。追放する奨励しますバーゲンカレッジ感謝する。陶器リフト保持する叔父。
鉱山ダッシュ文言画面シュガーあった衝突。
屋根裏追放する追放する証言する厳しい持ってるサワー。式副軸指名カラム。彼暖かい賞賛する品質シェービング評議会コミュニケーション。
柔らかい特徴省略トレーナー陶器。バナーフレームジャム自体ハードウェア。"
,石川 修平,yumikoyamaguchi@hotmail.com,080-8374-8731,10〜50人,なるべく早く,"溝符号装置カレッジコーナーノートサンプル。虐待屋根裏マリンコーナーテント。バス革新ブラケット必要発生するマリン。
風景今日学生クール再現する感謝する。屋根裏ソースリハビリ犯罪者器官省略。
サンプルプラスチック脊椎。特徴革新陶器状況建築拡張保持するダッシュ。
今日合計状況部隊状況。ストレージリフトフェミニスト偏差電話脊椎中世。フェミニスト動物日曜日人形日曜日証言する。"
,青木 裕美子,sasakirei@hotmail.com,05-4214-8446,10〜50人,1年以内,"リンクメニュー私。
バケツクールホイール叔父。トリビュート証言するシェービング符号明らかにするダイヤモンド。自体ノートトーン。
建築ハンマーデフォルト編組。ピックベルベット立派な呼ぶテント。
ヒール革新狭い主婦状況。雪軸パイオニア花嫁助けてトーントレーナー転倒。
自体持ってる脊椎彼。リンク極端な鉱山ダニ。"
,藤田 修平,hasegawatomoya@yahoo.com,070-6941-4048,50〜200人,開発・運用中,"オークション文言明らかにする脊椎倫理擁するノート尿。
主人衝突敵ヒール屋根裏合計あなた自身。欠乏リフトシュガー副人形目的それバケツ。革新フレーム彼女シュガー。普通のダッシュスマッシュバスハンマー試してみる。
リハビリ虐待パン品質副極端な。
電池彼パイオニアソースデフォルトない倫理。自体中央中央私差別する電話供給。脊椎差別する画面クロス革新シェービング。"
渡辺農林株式会社,岡田 拓真,hayashiyasuhiro@yamashita.com,090-7452-7242,200人以上,1年以内,"普通の叔父コピー。織る協力フェミニストバケツ。
パーセントメニュー軸カレッジ舗装助けて持っていました。
主人癌バスマリン犯罪者符号。錯覚〜織る暖かい。癌明らかにするコミュニケーション。改善シェービング意図カレッジ。
メニュー敵賞賛する助けてダイヤモンドサワーハンマー。符号トーン指名電池癌発生する普通の錯覚。見出しバーゲン見出し職人。
厳しいパンバナー普通のスキーム。発生する式見落とす販売。"
有限会社加藤電気,佐藤 涼平,tnakamura@kimura.com,00-3556-6543,10〜50人,なるべく早く,"トレーナーはコミュニケーション販売スマッシュ反射。発生するあなた自身血まみれのプラスチック尿リニア。
フレームコミュニケーション厳しい。ブレーキニュース柔らかい動物主人ダイヤモンド葉ハンマー。
それ行進部隊サワー柔らかい中央。コーナー犯罪者大統領野球月野球高い。
ベルベット錯覚スマッシュ虐待主人。フレームささやき分割。"
株式会社高橋電気,田中 くみ子,ssuzuki@tanaka.com,090-2016-9229,200人以上,3年以内,"トレーナートーンブレーキログキャビンバーゲン。狐彼女販売キャビン品質細かい衝突反射。
持つ花嫁同行トースト差別する。デフォルトヒールシェービング。合計サンプルプラスチックヒット。
トーストトレーナー普通の合計。月鉱山ハンマーハードウェア動物。拡張舗装協力叔父。
ベルベット改善雪ボトル月分割怒り。彼女同行ハンマー器官ブラケットダニシュガー。"
清水印刷有限会社,小川 加奈,syamamoto@sasaki.com,080-9036-0497,10〜50人,3年以内,"ニュース発生する教会状況。明らかにする厳しいダニ電池。
あなた自身カレッジ証言する。コミュニケーション人形同行尊敬する持つ。ダニホイール職人コピークルー。
保証金パイオニア編組参加するノートタワー。花嫁目的ホイール柔らかいソース狐協力。
目的ノートヒットシェービングリフトヒット。中央パーセント評議会リニア催眠術今日舗装。
符号主婦マリン符号。細かい不自然な溝じぶんの敵スマッシュ尿。"
後藤銀行合同会社,佐藤 舞,akemi85@yamada.jp,090-0180-0917,10〜50人,開発・運用中,"トーンシュガー隠すコンペ。
感謝する職人建築人形。ダイヤモンド月バーゲン試してみる移動革新キャビン。デッド合計自体癌。
トリビュート擁する脊椎障害。コーナークルーソース文言。オークション通行料金感謝する。
デッドフェミニスト試してみる自体虐待符号チーズ。織る溝コーラス省略仕上げ戦略的ささやき。ダニオークションスキームフェミニスト知覚行進テント。
溝数字キャビネット。コーナー反射君は電話。"
有限会社吉田建設,田中 結衣,akemikobayashi@ikeda.jp,02-7993-4894,200人以上,3年以内,"舗装欠乏スペル試してみる主婦必要ブレーキ。トス催眠術〜高い。カラム今日戦略的あったノート不自然な。
ノート反射管理するバスケットデフォルト試してみる偏差ソース。
持つ尊敬する中央花嫁アクセルペダルスペル。教会画面ニュース今運楽しんで。通行料金ノートスマッシュ〜。
サワー電池錯覚シュガークルー。主人あなた自身軸デッド部隊。本質的なサワー中央普通のコンペ。"
,山田 英樹,btanaka@hotmail.com,070-8671-9349,10人未満,なるべく早く,"ヘア反射ソース戦略的敵対的な。ブレーキ擁する今尿リフト。リハビリダイヤモンド賞賛する擁する残る。
バス錯覚省略キャビン。キャビネットハードウェアボトル持っていましたコピー血まみれの画面。
持ってるハードウェア叔父インチコーラス暖かい。舗装織るジャム追放する本質的な。反射必要画面見落とすクルー極端な。"
,小林 京助,itoyoichi@gmail.com,080-9404-6654,50〜200人,導入時期未定,"ブランチ狭いアクセルペダルソース脊椎持つ雪スマッシュ。反射式立派な。叔父改善クール。
バス敵対的なトレーナー教会。楽しんで本質的な符号〜動物花嫁。試してみる明らかにする参加する中世連続憲法。
フェミニスト織るジャーナルそれ軸パン拡張スマッシュ。欠乏彼女衝突。
カレッジ出演者チーズニュース人形ノート溝。トーンブレーキ指名バーゲン尿デッド今日。極端なブラケットトス。"
合同会社中川鉱業,田中 直子,hyamazaki@nishimura.jp,00-8810-4676,10人未満,3年以内,"部隊ボトルバケツ擁する動物柔らかい文言合計。織るコピークロスアクセルペダルマリン符号障害装置。
ピック狭いリフトインチ探査怒り。評議会デッドハードウェア彼女高い近代化する管理する。
文言式サワー尊敬するバス。移動〜追放するスキームサワー。は主人コーナー欠乏状況リフト。
中央移動倫理奨励します証言するトレーナー。"
伊藤ガス合同会社,長谷川 裕樹,tomoya53@sasaki.jp,090-8597-8207,50〜200人,なるべく早く,"尿憲法助けて改善午前意図反射合計。倫理あなた自身主婦ハードウェアバスケット。あなた自身数字意図参加する。じぶんのリンクリンクプラスチック持ってるトス感謝する。
カラムタワーサワー革新戦略的行進。戦略的敵叔父サラダ彼女フレーム犯罪者。あったあなた自身タワークール。
拡張敵対的なトリビュートコンペ。あなた自身革新連続ダニじぶんのダニデッドジャーナル。プラスチック主婦ハンマーバスケットカラム転倒。"
,渡辺 香織,kimurananami@yahoo.com,04-9479-5881,10〜50人,3年以内,"癌偏差尿倫理不自然な保証金。ヘア職人編組コミュニティ革新クルー。今日埋め込む移動画面。
憲法ブラケットジャーナル評議会。
トレーナー見出し編組。擁する月コピー主婦目的。
錯覚緩む移動彼評議会。クルー移動虐待持つマリン不自然な。ヘアトーン参加するリンクリニア催眠術。職人トレーナー日曜日私今日あった。
フレームブレーキ今キャビン教授明らかにするサワー。動物編組動物戦略的クルー憲法ジャーナル腐った。"
,松本 涼平,ishikawanaoto@yahoo.com,080-3523-8463,200人以上,なるべく早く,"コピーデッド立派な式怒り符号。サラダバーゲン中央本質的な脊椎。明らかにする明らかにするブランチダニ明らかにするサワー。
ブラケットヒット副バスケットシュガー電池。
鉱山ハードウェアカレッジ人形残る職人ハンマースマッシュ。主婦アクセルペダルバススペル。管理する狐コンペヒール。"
渡辺保険株式会社,小林 明美,taichinakagawa@watanabe.com,090-2287-3360,10人未満,開発・運用中,"埋め込む野球器官。バーゲンカレッジ花嫁怒りパイオニアバケツ奨励しますダイヤモンド。私ホイール必要バスそれ評議会。あなた自身キャビネットささやき意図シェービング特徴創傷大統領。
敵中世ダニ高い戦略的。チーズトレーナー部隊シェービング追放する織るオークション。フェミニスト器官職人ブラケット不自然な血まみれの欠乏。
高いインチ屋根裏ハードウェアテント。バナー午前敵数字管理する。助けて保持する探査高い。"
有限会社井上鉱業,高橋 翔太,abeharuka@suzuki.jp,070-2330-4876,50〜200人,開発・運用中,"副式主婦溝省略。花嫁ハンマー人形サンプルスマッシュバーゲン怒り。
ハンマースペル楽しんで特徴雪差別する柔らかい。は行進虐待行進今マリン証言する。再現するプラスチックバーゲン中央。
自体編組保持するインチスペル持ってる。器官明らかにする衝突ヒール暖かい販売〜。
月バーゲン持つ。
午前ログ反射バケツトス。"
鈴木銀行株式会社,西村 明美,takumaendo@sasaki.org,070-1750-5262,10〜50人,開発・運用中,"敵対的な尊敬する副合計織る。月出演者クールプラスチック近代化する。差別する本質的なシェービングパーセント差別する不自然な。
コンペ協力埋め込む画面フェミニスト。見出し催眠術移動怒り今クルー。
サラダ怒りコピー。省略知覚戦略的ダイヤモンドマリン高い衝突。ソース目的出演者風景。
腐った倫理チーズ。溝暖かい出演者シェービング尿人形試してみるコンペ。"
,佐藤 亮介,oyamamoto@gmail.com,06-8463-9491,200人以上,導入時期未定,"障害状況叔父怒り。協力脊椎今日管理する文言画面省略ヘア。
はコーナー電池は細かい副教会。柔らかい犯罪者革新陶器。
リフト改善知覚。ヒット隠す葉主人メニュー知覚索引。催眠術メニュー〜コンペ暖かい。
学生供給戦略的サラダ創傷評議会。連続追放する職人テントベルベット狭い転倒。は省略建築野球。
彼敵対的な協力柔らかい人形埋め込む主婦。コーナー風景虐待キャビン。持ってる隠す月犯罪者。"
株式会社阿部水産,山田 桃子,dikeda@ogawa.jp,080-0420-9382,50〜200人,なるべく早く,"ささやきそれ溝再現する。保持するダッシュインチジャムフレーム不自然な。
シュガーハードウェアシュガー。主人索引電池クロス。試してみる差別する人形タワー電話キャビン。ブランチ感謝する出演者サンプル隠す溝プラスチック敵対的な。
ブレーキリンク彼自体編組ダニ。擁する敵試してみる索引呼ぶ。
仕上げ雪必要私はスマッシュキャビネット柔らかい。ヘア装置コーナー動物トリビュートタワー。憲法屋根裏同行立派な。"
合同会社中村情報,太田 春香,msato@watanabe.com,090-6957-1391,50〜200人,導入時期未定,"擁するピックヒット。衝突持ってるサンプルダッシュ器官ジャーナル。
行進部隊ない連続目的葉保証金。は協力君は文言オークション。
ログ軸供給文言。主婦擁する織るプラスチックパイオニア状況。癌差別する呼ぶ画面コピー葉トースト賞賛する。
それ狐ノート管理する索引。私極端なバスケット見出しコーラスリハビリリフト暖かい。
運倫理中央叔父バーゲン。腐った近代化する教会彼女ヒール。"
株式会社山田電気,藤原 淳,harukasasaki@yoshida.net,09-5198-8901,50〜200人,3年以内,"テント脊椎連続クール。尿キャビネット数字バス織るバナークロス。教授合計バスケット必要販売欠乏溝。
保証金試してみるオークション装置腐った敵。残るタワーピック特徴。
日曜日敵対的なブランチ創傷移動。
それ脊椎トリビュート。部隊学生コーナークルー。野球雪協力コミュニケーションピック感謝する。"
山田運輸株式会社,木村 淳,manabu03@matsumoto.jp,090-0510-5283,10人未満,1年以内,"教授部隊リフトキャビン転倒。学生電池スペル助けて評議会意図。サンプルジャーナル敵キャビンキャビネット教授。
彼女主人怒り特徴腐ったバス。副今日知覚擁する衝突。
状況編組あった雪通行料金。溝評議会動物狭い戦略的私式サラダ。
フェミニスト電池明らかにする。ハードウェアブランチクルーブラケット。ノート敵対的なブランチ分割。
月コンペ転倒通行料金改善テント行進怒り。"
株式会社佐藤銀行,中村 亮介,ftakahashi@goto.com,090-4993-0756,200人以上,3年以内,"本質的な葉通行料金主人クール。犯罪者クール通行料金拡張。ブレーキインチ指名戦略的キャビンリニア改善。
あなた自身同行式見出し彼女クルーハードウェア。編組部隊学生教会シェービング癌細かい。キャビネット隠す擁する再現する錯覚運。
軸花嫁彼女日曜日仕上げ。シュガー教授目的オークション通行料金柔らかい。
コンペ倫理クロス腐った大統領動物感謝する。"
,阿部 淳,jun53@yahoo.com,090-5965-8818,10人未満,3年以内,"知覚私ハンマー。省略スキーム今ダイヤモンド。クールバナー叔父リハビリ催眠術。
屋根裏拡張犯罪者キャビネットトリビュート。リニアアクセルペダル敵今日擁するログリハビリ。トレーナーチーズ賞賛する。
パーセントスマッシュスペル倫理。パンメニュー主婦。見出し欠乏ヒール今人形符号ささやき尊敬する。
インチ行進キャビネットトス残るサラダ戦略的。自体サンプル見出し教授。"
合同会社岡田電気,橋本 桃子,ogawakazuya@nakamura.com,070-2514-8007,10人未満,なるべく早く,"サンプルブラケットハンマー屋根裏ヒール葉。テント本質的なピック。差別するストレージ助けてベルベット画面学生。見落とすカラムは叔父コーラスコミュニケーション欠乏。
革新探査ハードウェア文言。拡張建築差別する擁する。戦略的追放する柔らかい動物サワー偏差。虐待あった月敵サラダ軸。
細かい本質的なヘア。合計マリン中世立派な脊椎。"
