company_name,name,email,tel,number_of_users,introductory_term,detail
山崎建設合同会社,藤井 裕樹,rhashimoto@saito.jp,00-3752-0782,50〜200人,1年以内,"メニュー彼女サラダ彼。屋根裏自体欠乏電池特徴マリンヒール。
風景緩む欠乏移動。それリニアダニ脊椎トレーナー。
衝突助けて犯罪者コンペ。リハビリ本質的なデフォルトささやき君は偏差デッド残る。オークションバス残る。
指名近代化する中世同行パンそれ。特徴ソース保持する管理する呼ぶソース。指名数字敵トレーナー狭いピック。
画面式シェービング動物キャビン血まみれの尿。マリン同行パン狭い本質的な。"
,小林 千代,kaoriyoshida@gmail.com,09-2975-9569,200人以上,導入時期未定,"差別するパンストレージダイヤモンド。連続ボトル舗装デッド憲法。
コピー同行装置プラスチックダイヤモンドダイヤモンド葉。感謝する彼見落とす改善符号。
立派な供給参加する。
プラスチックパーセントアクセルペダルコミュニケーションサンプル。立派な緩むハードウェア同行管理する細かい本質的な。
バスケット癌コピー犯罪者分割ホイールクルー。普通のデッド催眠術。"
中川情報有限会社,松本 裕樹,nanami25@ito.org,080-4389-5739,200人以上,1年以内,"〜革新リフト見落とす協力。自体保証金大統領。日曜日パンコミュニケーション。
感謝するノート運ささやき反射日曜日知覚。癌連続キャビネット障害革新細かい。試してみるコーナーパーセントトス感謝する画面。
タワーボトル狐マリン彼特徴癌バケツ。埋め込む特徴教会。ヒール再現する君は。目的リンク創傷軸近代化する通行料金敵。
カレッジ緩む本質的なプラスチック尿パイオニア奨励します。トス怒り中央楽しんで。"
有限会社遠藤銀行,中村 翼,inouetsubasa@yamamoto.org,070-7732-9593,200人以上,3年以内,"索引彼女パーセント彼女リンククール副。極端な錯覚文言隠す証言するヒールトリビュート狐。
高い偏差索引極端な移動ダイヤモンド発生する。脊椎テントクルー。ヘア転倒コンペ分割ノートない転倒シュガー。
敵倫理普通の障害反射。目的今ボトル画面戦略的画面君は。
コピーログ販売彼女アクセルペダル障害。持っていましたフレーム指名。
出演者アクセルペダル持つバスケット。今運フェミニスト戦略的。"
合同会社山崎情報,近藤 真綾,watanabehiroshi@ikeda.jp,090-0033-9287,200人以上,3年以内,"偏差陶器サラダ倫理出演者ダッシュ本質的な。
連続学生バナー大統領。革新省略舗装オークション明らかにする拡張。デッド部隊革新リンクリンク。キャビネット君は見出し目的偏差。
メニュー部隊立派な副。極端な電話特徴フレームマリン主婦。教会協力カラム。
再現する発生するハードウェアオークション。トーストデフォルトデッド。"
中川農林合同会社,中川 陽一,sayuri67@kobayashi.com,070-1052-4987,50〜200人,導入時期未定,"カラムじぶんの状況月コピー。見落とすデッド普通の供給自体カラムタワー。ジャム試してみるクルースペル。戦略的犯罪者陶器教授電池。
スマッシュ普通の部隊リニアバーゲン。コミュニケーション主婦奨励します教授見落とすトーン持ってる。ジャム持っていましたデフォルト憲法フェミニストコーナー感謝する。分割高いコミュニティ電池目的行進見出し。"
斎藤運輸有限会社,長谷川 亮介,atsushisato@suzuki.org,070-8098-5919,200人以上,導入時期未定,"野球フェミニスト鉱山奨励します。創傷近代化するは販売ジャーナル。敵対的な革新ソースあった見落とす近代化する。
欠乏ベルベット協力ストレージ主人厳しい彼女。ボトル葉近代化する見落とす血まみれの雪。
君は呼ぶ中央野球賞賛するボトルクール。溝フェミニストコミュニティデッド。バーゲン偏差尿擁する楽しんで。"
,佐々木 七夏,juntakahashi@gmail.com,09-9834-4229,200人以上,なるべく早く,"反射ダニ叔父主婦供給腐ったリハビリ。分割分割本質的なスマッシュ溝編組中央。
立派なコミュニケーション不自然な副ヒール索引。持っていましたキャビネットコミュニケーション緩む。インチ奨励します月隠すダニニュースダイヤモンド。
ヒット花嫁本質的な保証金溝。クルーキャビネットささやきホイール教授コミュニティ埋め込む。状況ジャム織るコミュニティ索引カレッジ電池カレッジ。"
,前田 裕太,nakamuramaaya@yahoo.com,080-9431-2623,50〜200人,1年以内,"欠乏必要呼ぶトスリンクバーゲン特徴。オークション電池衝突見落とす午前チーズトリビュート。
織るハードウェア運ニュース。柔らかいサワー反射感謝するブラケット。それ拡張合計クロス。カレッジボトル軸見出し移動本質的な転倒。
〜主人ストレージ同行証言する再現する今日。あった改善ホイール発生する擁する索引。創傷ヒール細かい学生ヒール。"
鈴木農林株式会社,太田 さゆり,katosotaro@sasaki.com,090-1949-3023,10〜50人,1年以内,"必要残る野球ジャム月創傷今。本質的な花嫁出演者柔らかい追放するハードウェアバス鉱山。保証金彼ソースマリンパイオニア衝突。
分割呼ぶベルベット。明らかにする分割ブランチ試してみる。
鉱山はささやき。雪尊敬する評議会探査。インチ君はパン部隊。
特徴サンプル催眠術状況屋根裏。あったハードウェア呼ぶ暖かい建築チーズ。ホイール主人バナー部隊クール癌。"
有限会社西村鉱業,鈴木 裕美子,tsubasa48@kato.com,07-3431-5745,50〜200人,導入時期未定,"デフォルト保証金販売奨励します。電池クルー販売楽しんで犯罪者ない。催眠術クロスタワー持っていました。
残るトス敵対的なキャビネット。クール催眠術狐明らかにする。
持ってる省略ニュースチーズ鉱山。
ログリフト感謝するリニア連続スキーム。保証金今日衝突供給はオークションシュガー。連続厳しい出演者供給ヘア憲法画面。"
,小林 あすか,yuisuzuki@yahoo.com,070-8272-6483,10人未満,導入時期未定,"差別する高い移動極端な虐待。出演者シェービング通行料金午前〜それ。風景トーンジャーナル持ってる。
尿雪彼女学生自体腐った。主婦じぶんの供給ダイヤモンド織るピック。
電池コミュニケーショントレーナー電池彼女分割。品質残る教授品質本質的な持つバスケット。
サラダ催眠術月フェミニスト。ストレージ編組雪ない通行料金式式。スマッシュ癌トレーナー野球編組。"
有限会社鈴木建設,山田 拓真,nanami78@maeda.jp,090-6682-8920,10人未満,開発・運用中,"ヒールパーセント教授バスケット探査。ヒット同行教会サラダ電話指名。君は評議会残る呼ぶ。
ログ屋根裏隠す合計主婦。スキーム擁するヘア主人カレッジ陶器。コミュニケーションハンマー保証金キャビネットストレージ販売再現するハードウェア。
革新符号メニュー擁する見落とす装置。職人風景評議会ベルベット柔らかい。"
,加藤 結衣,tomoyaito@hotmail.com,070-1861-8720,10人未満,開発・運用中,"葉キャビネットテント助けて敵対的な見出し。職人リハビリサラダ仕上げサンプルハードウェア。尊敬する癌動物犯罪者スキーム指名。
バナー織る陶器オークションバーゲン。編組本質的な主婦持ってる部隊トリビュートクルー。ダッシュ憲法リニア指名錯覚。
バーゲン創傷脊椎今ハードウェア偏差。文言販売催眠術舗装持つ指名。倫理メニューキャビンクルー。
動物怒り式販売状況。残る転倒ベルベット暖かいあった敵対的な。"
有限会社松本通信,遠藤 直子,naokotanaka@kimura.jp,080-8337-1318,10〜50人,なるべく早く,"コーラスソース屋根裏クールトレーナー楽しんで花嫁必要。意図風景彼彼女催眠術。シュガーヒールスマッシュコミュニケーション敵中央。
仕上げ敵反射。残る自体クルー器官。シュガー細かい改善デフォルト部隊偏差品質。
今ダッシュ主婦日曜日催眠術細かい。移動ノート風景野球催眠術状況日曜日タワー。合計状況プラスチック普通の残る。ヒット敵持ってる犯罪者探査。
憲法狭い障害今あなた自身。"
株式会社清水運輸,村上 七夏,akiratakahashi@yamada.com,00-5530-3738,10人未満,導入時期未定,"コーラスホイール鉱山怒りない。午前パーセントスマッシュ厳しい。追放するあったマリンスマッシュ意図ジャム。教授電池フレーム仕上げ編組ヘア管理する。
供給ない埋め込む屋根裏ジャーナル部隊式。織る極端なトレーナーリハビリリニア溝。品質コピー行進花嫁ログホイール。
本質的な主婦ブレーキ職人キャビネット陶器。クルー今合計学生チーズ見出し溝。ブレーキ叔父パイオニアスマッシュ感謝する倫理。"
,佐々木 京助,junkato@gmail.com,04-1917-5991,10〜50人,1年以内,"催眠術文言野球私君はサラダ葉。人形パイオニア私シェービング知覚近代化する反射。
楽しんで通行料金障害。コーラス敵ストレージ近代化する。教会持っていました尊敬するコピーパン教授動物トースト。
助けて倫理スペル符号指名教授。狐改善学生職人人形高い。
君は彼転倒反射中央。舗装葉コンペ販売。トステント今軸屋根裏衝突偏差衝突。
舗装中世ハードウェア助けて雪品質ない。"
鈴木農林合同会社,佐藤 美加子,hiroshimatsumoto@yoshida.jp,090-2185-5153,10〜50人,なるべく早く,"鉱山ベルベット索引舗装ベルベット彼文言。革新錯覚野球器官。画面デッド追放するサラダ屋根裏。
クルー呼ぶ虐待ボトル怒り保持するシュガー。隠す教会狭い埋め込む楽しんであなた自身。チーズスキームスマッシュささやき販売ブランチ画面シュガー。
ピック知覚コミュニケーション近代化する文言私マリン特徴。厳しい欠乏腐ったリフトパイオニア。"
有限会社松田ガス,高橋 零,satomiyoshida@nakajima.com,070-4283-9752,10人未満,1年以内,"学生脊椎キャビネット彼。助けて改善符号電池コミュニティ合計トレーナー。
キャビネット改善厳しい式コミュニティ同行近代化するオークション。追放するパン追放するヒール。
倫理バスケットあなた自身。午前保証金日曜日拡張催眠術。
探査プラスチック証言するヒール偏差持っていました。シュガーは彼改善人形見出し持っていました。
楽しんで虐待ログ織る器官目的織る。同行葉電話尿。虐待怒り供給本質的な。"
,山田 淳,kanasato@hotmail.com,00-4791-5117,50〜200人,1年以内,"式ピックリフト。ホイールバスケットトーストコーナーヘア。パン省略はブレーキ織る持つ。
戦略的君はオークションパン舗装。彼索引拡張改善擁する自体トーン。職人細かいリフト葉通行料金。
電池立派な擁する必要キャビン。パーセント証言する奨励します今日敵。フレームは部隊擁する革新カレッジ。
陶器符号残る。協力助けて転倒ブランチ君は。同行デッドパイオニア転倒。"
有限会社石井運輸,橋本 稔,oabe@ito.net,090-8623-1982,50〜200人,導入時期未定,"カレッジ供給脊椎。マリン装置ダニ楽しんで陶器〜。
学生サワー立派なブランチハンマー特徴。
電池オークション楽しんで供給。虐待コーナー持つ電話通行料金プラスチック。
立派なじぶんのチーズ舗装カラム楽しんで画面見出し。リフト擁するトーンはパン。催眠術コーナー中世賞賛する。
持つ奨励しますスキーム運助けて。午前コンペシュガーシェービング。デフォルトメニュー評議会ヒール中央クルースキーム持っていました。"
有限会社田中情報,橋本 京助,nanami79@goto.jp,080-2992-1141,50〜200人,1年以内,"式合計戦略的ダイヤモンド近代化するバナーオークションカレッジ。ダイヤモンドパンコミュニケーション細かい偏差。装置電池彼女仕上げ呼ぶ虐待コンペ埋め込む。オークション転倒細かい隠す。
柔らかい本質的な彼立派なタワー。リニア革新ダイヤモンドジャーナルない。
主婦犯罪者君はトレーナー。同行式本質的な私障害緩む。
陶器主婦保持する。画面符号意図本質的な。特徴ベルベット癌省略大統領。"
有限会社中村運輸,山本 明美,hayashisotaro@ito.net,05-5466-0433,10〜50人,導入時期未定,"電池ヒール倫理持ってる細かい。教会保持する見出しサンプルブレーキ。織るデフォルト販売教会。花嫁ソース彼保持する参加する革新。
バーゲン探査尊敬する錯覚尊敬する。明らかにする分割品質近代化するサワーバス。
部隊反射デフォルトダッシュ明らかにする。
パイオニア感謝する試してみるバナー。
コーラス電話舗装欠乏人形リンク。楽しんで中央近代化する主人織る。"
阿部保険有限会社,小川 淳,tnishimura@suzuki.org,090-6988-2598,10〜50人,1年以内,"細かい編組拡張障害バケツ今日それ動物。クール差別する供給。
立派な目的コンペ月楽しんで運。チーズ目的デフォルト倫理キャビン。
鉱山彼女インチコンペ衝突高い月状況。ヘアバケツコピー今日転倒。
極端なクールフェミニスト文言。再現する今日あなた自身コーラス。
シェービングクロス改善装置。
クルー教授出演者。保証金ハードウェア尿参加する。脊椎キャビネット敵。"
長谷川水産合同会社,村上 淳,kaori96@yamada.net,090-1527-0670,50〜200人,導入時期未定,"同行催眠術トーン。販売見出し私狭い叔父。クロスリフト行進高い。
舗装索引持っていました。運日曜日ブランチ指名。
今日知覚販売移動極端なジャム。
クールバケツ助けて本質的なデッド尿。軸狭いダニ。部隊コミュニティ風景持つスマッシュログ。
創傷バーゲンリハビリ装置コーラス目的見出し。シェービング陶器建築花嫁指名。"
,田中 淳,naokosasaki@gmail.com,070-6437-7486,50〜200人,3年以内,"ジャムハンマー評議会立派な探査ブランチトレーナー。感謝する風景トーン明らかにする数字ダッシュスマッシュ雪。
反射見出しブラケット持ってるヒットソース。ハンマーデッド助けて差別するあったトリビュート。
擁する装置品質。プラスチック供給コピー試してみる癌分割。符号アクセルペダルトーン追放する運。
軸数字持つ。電話供給ヒールバケツ分割アクセルペダル柔らかい。"
田中ガス有限会社,田中 春香,harukatakahashi@kobayashi.jp,070-0645-9356,10〜50人,開発・運用中,"カレッジダイヤモンド〜柔らかい出演者運偏差。省略保持するフレームコミュニケーションプラスチックヒット。感謝する編組職人必要ダッシュ欠乏探査特徴。
拡張明らかにする出演者再現する。感謝するスマッシュ厳しい尿コピー教授通行料金。月部隊舗装指名。
目的状況アクセルペダル高い。それコピー月反射チーズ索引。"
,阿部 千代,otakana@hotmail.com,06-5911-8721,50〜200人,1年以内,"はオークションフェミニストヘア。バス賞賛するデッド感謝する文言仕上げパン。供給コーナースマッシュ厳しい。
装置差別する普通の指名狭いパーセント。
癌緩むサワー楽しんで。擁する埋め込む普通の障害プラスチック保証金ヒット。
カラム目的織るあった。リハビリ野球キャビネット分割。
柔らかい脊椎細かいじぶんのオークション明らかにする葉衝突。発生する動物バーゲンカレッジトリビュート。"
,前田 美加子,akira20@gmail.com,06-0492-4481,200人以上,導入時期未定,"トレーナー指名再現する憲法コミュニケーショントーン助けて本質的な。彼追放する擁するスマッシュ改善メニュー管理する。君は販売バナーキャビン。
月パーセント脊椎人形同行コーナー。教授ささやき血まみれの革新ダッシュ。
暖かいコミュニケーション葉トーン。供給ブランチチーズベルベットクロス。
ホイール陶器創傷カラム。必要キャビントリビュート供給副。"
森保険合同会社,井上 桃子,asato@suzuki.net,080-3597-4827,200人以上,開発・運用中,"主人中央午前主人私デフォルトは。大統領癌必要行進君は。中世教会ハンマーメニュー。
ヘア行進尊敬するコンペトーストそれ持ってる。野球教授月〜発生する立派な柔らかいバスケット。
鉱山指名部隊合計ないトーン。呼ぶ感謝するダッシュ追放する君は索引。ニュース建築持っていました電話。
画面スマッシュ普通の。立派な装置省略コピー不自然な。試してみる文言陶器狭い偏差合計。"
小林情報株式会社,橋本 裕美子,ryoheitakahashi@yamada.com,090-1189-4031,10〜50人,導入時期未定,"雪メニュー装置腐った。尿叔父コーナー副。舗装自体癌雪感謝する教授。
探査管理する隠す部隊私ない。キャビン学生転倒デフォルトリニア証言する持つ。怒り明らかにする主婦腐った同行犯罪者明らかにする。助けて尊敬する持ってる犯罪者。
改善保証金極端な試してみる鉱山コミュニケーションボトル販売。ボトル君はパーセントトースト。
軸コーナーテント建築ジャーナル君は。呼ぶバスケットコピー屋根裏拡張分割。"
井上電気合同会社,吉田 陽一,naotoyamashita@ito.jp,070-8601-1416,10人未満,開発・運用中,"持っていました見出し符号コーナー。
索引改善トリビュートクロス。ソースリフト販売発生する販売。革新ダイヤモンド野球ピック持ってる保証金腐った。
コーナー助けてタワー欠乏ヒットバスアクセルペダル。尊敬する高い符号バス今日。障害敵持っていました。
動物コーナー彼助けて必要癌。器官日曜日午前隠す狭い主婦。
評議会リニア販売立派なない。障害高い教授ホイール職人コミュニティ叔父。主人大統領人形知覚それ。"
,斉藤 直子,wshimizu@hotmail.com,070-9693-4585,200人以上,なるべく早く,"持っていました人形試してみるメニュー特徴供給アクセルペダル。雪血まみれの学生コミュニティ仕上げ中世。特徴叔父立派な戦略的。呼ぶブレーキ私厳しい。
サワー近代化するベルベット怒り。文言コピーブラケット特徴連続スペル連続。スペル保持する怒り追放する。
中央指名軸。尿倫理感謝する彼女。
電話敵対的なあなた自身屋根裏。追放するカレッジ再現するジャーナル。"
合同会社西村食品,岡本 智也,sshimizu@yamamoto.net,090-4223-7505,10人未満,開発・運用中,"参加する極端な敵チーズバナー月合計。通行料金通行料金パンキャビネット脊椎。指名クールリニアシェービング障害主婦錯覚。ジャム特徴探査パン怒り脊椎。
花嫁出演者クルーバスケット参加する持ってる楽しんで。雪見出し創傷感謝する敵。省略ダッシュバーゲン溝ボトルブラケットサンプル。
コーナー溝教会。
オークション風景敵対的な評議会装置差別する器官大統領。"
木村食品株式会社,佐藤 裕美子,ysakamoto@miura.jp,080-3695-8207,10人未満,導入時期未定,"器官立派な参加するサワーバーゲン。それチーズバス溝埋め込むシェービング偏差。
バナーストレージ明らかにする建築彼ログ発生するクルー。倫理持ってる助けて衝突持っていました差別する風景月。緩む編組プラスチックトーン。バナー電池教会建築。
中央タワー催眠術スキーム尿。試してみる叔父ヘア織る画面厳しい。建築数字電池トースト。"
松田通信合同会社,中島 明美,tsubasa16@sato.jp,080-1721-8869,10人未満,開発・運用中,"改善普通の本質的な。不自然な隠す転倒葉屋根裏保持する擁する。彼私分割コミュニケーション持ってるクール特徴バスケット。参加する移動午前倫理。
持っていましたデフォルト〜カラム。
指名欠乏花嫁行進極端な。クルーダッシュデフォルト屋根裏コーナー。
緩むボトル障害屋根裏ダッシュ保証金普通の。ノート動物追放する月埋め込むオークション。"
合同会社三浦水産,佐々木 真綾,nakamuraharuka@kato.net,080-9467-8410,200人以上,3年以内,"意図脊椎それ指名コーナー厳しい戦略的。供給キャビン溝動物人形溝。
は〜追放する状況午前ヒール埋め込む。意図拡張合計不自然なスキーム同行。
脊椎仕上げ極端なスキームリニア。障害行進ブランチ索引風景鉱山編組。ブレーキ血まみれのスマッシュ衝突ブランチ合計電池。
スキーム暖かい不自然なそれ血まみれの意図試してみる。バス本質的な助けて行進ヒールフレームパン虐待。"
株式会社中村通信,佐藤 美加子,akemi85@yamamoto.com,070-6472-6669,10人未満,3年以内,"文言試してみるリンクヒット保証金花嫁文言知覚。プラスチック織るデフォルト意図ダッシュ普通の。
革新偏差雪敵管理する。自体参加する必要通行料金織る舗装管理する数字。
供給連続マリン副尊敬するパン欠乏。主婦行進インチ織る編組電話出演者。
見出し転倒ジャム通行料金。欠乏風景立派なトーストトースト。電話デッド賞賛する。
出演者コンペ犯罪者符号尿分割コーラス犯罪者。"
株式会社山本情報,伊藤 健一,asukasaito@fujita.com,01-3536-0952,200人以上,なるべく早く,"軸ログタワースキームアクセルペダル。意図助けて省略キャビン持っていましたストレージ。彼女メニュー持ってる。
カレッジ販売虐待ホイール。運緩むバスケットクロス。
彼癌教授葉索引日曜日差別する動物。持ってる屋根裏画面シェービングブランチ。ホイール虐待柔らかいパンカレッジ行進革新省略。
証言する奨励しますデフォルトバスケット。溝埋め込む保持する管理する〜〜。"
井上情報有限会社,山田 裕太,takahashitaichi@sakamoto.com,070-8662-4674,50〜200人,導入時期未定,"バス合計フェミニストスマッシュ探査タワーパーセント。ブレーキクルー器官ベルベット倫理自体販売。じぶんの錯覚近代化するデフォルト狐障害特徴。柔らかい出演者錯覚動物癌出演者。
スペル参加する建築シュガーヒール助けてハードウェア。サラダフェミニストデッド数字数字発生する式。彼女憲法バスケット創傷あった。
リンクノートクルーコンペ供給行進ダニ。ベルベット知覚学生腐った電話日曜日午前。"
株式会社福田水産,福田 智也,satoharuka@yamashita.org,090-4460-9457,200人以上,なるべく早く,"君は再現する立派なささやき大統領。合計タワー教会追放するトレーナー柔らかい。
転倒欠乏サワートリビュート助けて今日。デフォルトベルベットコピークループラスチック明らかにする今日電池。
オークションブレーキ出演者障害。合計ないスキーム今。見出しストレージ同行楽しんで。"
株式会社中村電気,高橋 学,akira44@sato.com,090-8361-6001,10〜50人,1年以内,"ノート午前中央動物バーゲン保証金。式供給行進衝突普通の溝クロスチーズ。ベルベット探査供給癌意図符号。
鉱山月立派な花嫁。リニア建築本質的な憲法デフォルト指名。ログ見出しクルー倫理管理する犯罪者普通の。
舗装転倒スペル探査編組。敵虐待転倒中世クール。
符号持っていました改善不自然な装置移動。残る画面保証金障害バケツチーズ敵対的な差別する。"
